{
  "schema_version": 2,
  "mod_id": "my-example-mod",
  "engine": "Fabric",
  "minecraft_version": "26.2",
  "fabric_loader_version": "0.19.3",
  "fabric_api_version": "0.154.2+26.2",
  "fabric_loom_version": "1.17-SNAPSHOT",
  "gradle_version": "9.5.1",
  "java_version": "25",
  "entrypoints": {
    "main": "src/main/java/com/example/mymod/MyMod.java",
    "client": "src/client/java/com/example/mymod/client/MyModClient.java"
  },
  "run_argv": ["{gradle}", "runClient"],
  "creative_artifacts": [
    "src/main/resources/assets/my-example-mod/lang/en_us.json",
    "src/client/resources/assets/my-example-mod/textures/item/example_item.png",
    "src/client/resources/assets/my-example-mod/models/item/example_item.json"
  ],
  "engineer_artifacts": [
    "build.gradle",
    "settings.gradle",
    "gradle.properties",
    "gradlew",
    "gradlew.bat",
    "gradle/wrapper/gradle-wrapper.jar",
    "gradle/wrapper/gradle-wrapper.properties",
    "src/main/resources/fabric.mod.json",
    "src/main/java/com/example/mymod/MyMod.java",
    "src/client/java/com/example/mymod/client/MyModClient.java",
    "src/test/java/com/example/mymod/domain/ExampleRulesTest.java"
  ],
  "verifiers": ["compile-common", "compile-client", "unit-tests", "build"]
}
