{
  "schema_version": 2,
  "mod_id": "mana-core",
  "engine": "Fabric",
  "minecraft_version": "26.2",
  "fabric_loader_version": "0.19.3",
  "fabric_api_version": "0.154.2+26.2",
  "fabric_loom_version": "1.17-SNAPSHOT",
  "gradle_version": "9.5.1",
  "java_version": "25",
  "entrypoints": {
    "main": "src/main/java/com/manacore/ManaCore.java",
    "client": "src/client/java/com/manacore/client/ManaCoreClient.java"
  },
  "run_argv": ["{gradle}", "runClient"],
  "creative_artifacts": [
    "src/main/resources/assets/mana-core/lang/en_us.json",
    "src/client/resources/assets/mana-core/particles/mana_flow.json",
    "src/client/resources/assets/mana-core/textures/particle/mana_particle.png"
  ],
  "engineer_artifacts": [
    "build.gradle",
    "settings.gradle",
    "gradle.properties",
    "gradlew",
    "gradlew.bat",
    "gradle/wrapper/gradle-wrapper.jar",
    "gradle/wrapper/gradle-wrapper.properties",
    "src/main/resources/fabric.mod.json",
    "src/main/java/com/manacore/ManaCore.java",
    "src/main/java/com/manacore/api/ManaAPI.java",
    "src/main/java/com/manacore/api/events/ManaFlowEvent.java",
    "src/main/java/com/manacore/api/events/ManaGatherEvent.java",
    "src/main/java/com/manacore/api/events/ManaStoreEvent.java",
    "src/main/java/com/manacore/api/types/ManaConsumer.java",
    "src/main/java/com/manacore/api/types/ManaCreator.java",
    "src/main/java/com/manacore/api/types/ManaStorage.java",
    "src/main/java/com/manacore/core/storage/ChunkManaMap.java",
    "src/main/java/com/manacore/core/storage/ManaCoordinates.java",
    "src/main/java/com/manacore/core/flow/GradientCalculator.java",
    "src/main/java/com/manacore/core/flow/FlowEngine.java",
    "src/main/java/com/manacore/core/gather/SphericalGatherer.java",
    "src/main/java/com/manacore/core/ManaMath.java",
    "src/main/java/com/manacore/networking/ManaNetworking.java",
    "src/main/java/com/manacore/networking/ManaPacketHandler.java",
    "src/main/java/com/manacore/config/ManaConfig.java",
    "src/main/java/com/manacore/blocks/ManaGeneratorBlock.java",
    "src/main/java/com/manacore/blocks/ManaCollectorBlock.java",
    "src/main/java/com/manacore/blocks/ManaGeneratorBlockEntity.java",
    "src/main/java/com/manacore/blocks/ManaCollectorBlockEntity.java",
    "src/main/java/com/manacore/entities/ManaCrystalEntity.java",
    "src/client/java/com/manacore/client/ManaCoreClient.java",
    "src/client/java/com/manacore/client/visualization/particle/ManaFlowParticle.java",
    "src/client/java/com/manacore/client/visualization/ParticleManager.java",
    "src/client/java/com/manacore/client/visualization/overlay/ManaOverlay.java",
    "src/client/java/com/manacore/client/hud/DebugHUD.java",
    "src/client/java/com/manacore/client/networking/ClientManaPacketHandler.java",
    "src/test/java/com/manacore/TestManaCore.java",
    "src/test/java/com/manacore/core/storage/ChunkManaMapTest.java",
    "src/test/java/com/manacore/core/flow/GradientCalculatorTest.java"
  ],
  "verifiers": ["compile-common", "compile-client", "unit-tests", "build"]
}
